contract_address,occurrences,metadata_name,metadata_description
0x780f0cd3ac8091d996da23a12f174fb0f51b5894,1,Base generation 5316/,"Step into the bright and boundless world of future-generation NFTs, where creativity knows no limits and innovation knows no bounds. These digital marvels are not just tokens on a blockchain; they are the keys that unlock a doorway to a realm of endless possibilities.

Picture a world where artists, visionaries, and tech enthusiasts converge to shape a new era of expression. With NFTs, they've transcended the constraints of traditional mediums, for every stroke of a virtual brush, every line of code, and every pixel is a testament to their imagination.

In this era, owning an NFT is not just about possessing a digital asset; it's about owning a fragment of the creator's soul, a piece of their journey woven into the fabric of the blockchain. It's a connection that bridges time and space, as these tokens carry with them stories of inspiration, dedication, and the relentless pursuit of excellence.

Imagine a marketplace bustling with excitement, where collectors become curators, carefully selecting and showcasing NFTs that resonate with their individuality. As the NFT ecosystem evolves, communities flourish, nurturing collaboration, and propelling the collective vision forward. Together, they're building an archive of human creativity that will stand as a testament to our capacity to dream and innovate.

And let's not forget the creators themselves. Empowered by the potential of NFTs, artists are redefining their craft. No longer limited by physical boundaries, they're breaking new ground with dynamic, interactive, and immersive experiences. Audiences become participants, and the lines between creator and consumer blur into an exhilarating dance of shared inspiration.

The future-generation NFTs are not just a trend; they're a movement that speaks to the very essence of human progress. They're a testament to our ability to adapt, grow, and find beauty in the digital realm. As the world continues to shift and reshape, these tokens will remain beacons of optimism, reminding us that our potential for creation is limitless, and our dreams, when shared, have the power to change the world."
0x360ab052e8997d07dbb391b96daa3399758cab69,1,Onchain Summer ENERGY,"ENERGY, is a creative arts collective focused on artist and creative technology grants. 

If you want to be a part of creating culture and empowering artists on ZORA and beyond, join us â_x009a_¡ï¸_x008f_

Artists grants by ENERGY 

Artwork by 0xen.eth

https://www.777.energy/"
0x4b665de71d9d33c5f748b85f323b5860b685d223,1,Ice cream girl#,"Embark on a journey of nostalgic charm with Sweet Nostalgia, where a massive ice cream and a stunningly beautiful girl take center stage. The girl, adorned with long curly brown hair and dressed in vintage attire, harmoniously complements the ice cream backdrop. Drawing inspiration from Hong Kong comics, her look exudes vintage style and intricate detailing."
0x09da485811ea0a8f2d5f9d8e1c3a1d122942ddd4,1,Based Hero #,"Based of Mythology is a collection built on Base inspired by Greek mythology, featuring 10,000 warriors who fought countless battles until they became HEROES. This project is a tribute to Greek mythology, an immense and vast mythology spanning thousands of years that continues to be remembered and depicted today."
0x50e8aa83b81758afbc39b1de4cf46b3049488ffa,1,Base Ether Onchain Summer #,"100% on-chain generative art Base Ether, celebrating the Base Onchain Summer, 2023."
0x0ffccdbc951206ec6ec5ac227df73f6f48c45193,1,The Guardian #,The Degenerate Ape Academy stands with Coinbase as they fight for the future of crypto.
0x9df87e655aa4b132ae052db955720b043331d5e6,1,Cryptoshrunks #,While moving from Ethereum to Base as fast as possible - 3000 Punks survived - but they got damaged but they are still pbut they are still prettyy
0xa3b3d1f5daf2a2cf41b4061b09728f609211c0b7,1,Moonpepe #,A dedicated pepe collection made by 3 moonbirds holders. CC0 License. You own it.
0xa419c16423edd231d4d4240be725cf53a2088b29,1,PepeMania #,PepeMania
0xa48e48e52223de53b626eb2b71593393a7ac2a3d,1,Base Toadz Punks #,Base Toadz Punks
0x217ec1ac929a17481446a76ff9b95b9a64f298cf,1,Based Fellas #,
0x8ad0142e8cb3f74c065d9dce14813537b435f552,1,based degENS #,4444 based degENS are preparing to take over the Base Network. Created with love by degENS for degENS!
0x97f8ab195e2c258abf2e7660331eaf8c59eaa736,1,Base Ape Yacht Club #,Apes on Base
0x03fd46f4b9815aac86fe2e1ab6eb604ee1323915,1,Metaverse Doge,
0xb999ec5e57000540cbf821addbc69c37bf506f9f,1,A Paragon,"In ""A Paragonâ_x0080__x009d_ Maliha Abidi presents a captivating portrait of a South Asian woman where you are invited to the conversation to recognition the pressures faced, and the resilience held by women in meeting societal expectations. ""A Paragon"" poignantly prompts viewers to reflect on the hidden struggles behind perceived perfection and invites a reevaluation of the true essence of individual strength and identity within the confines of societal norms. Abidiâ_x0080__x0099_s piece explores themes of identity, societal pressures, resilience, and the contrast between expectations imposed and inner emotions."
0x2fc8f4aa3896ee55bcbb4af3d8fd18eda93a37ea,1,420Warrior,a 420 warrior
0xc9733a76b2d3c1ef154148e43450d8c7e72fe3f3,1,Spottie WiFi x Jim Jones: Buy the Dips #,"Dipset legend Jim Jones joins Spottie WiFi on the song Buy the Dips, the latest music NFT from Spottie's album The King's Alpha. The song and album are now streaming on all platforms. Visit spottiewifi.com and follow @SpottieWiFi on social media for special offers, utilities and airdrops for holders of this historic music NFT. Buy the Dips is produced by Stefan Clark. Photo by Mike Liu."
0x1a126d5d53815e44d8635f3a7e4547cf3dedced9,1,BasePunks #,"BasePunks is generative NFT collection with 1000 different uniqe variants.


BasePunks are inspiration from the iconic CryptoPunks, marking the inception of the contemporary CryptoArt movement within the Base blockchain ecosystem. "
0xb5813aab899e441b69a1e52ac50289aca106b64b,1,Pepe Original #,Hello PePe Fan
0xf125176aa6d570d5177dadf60e546e33920647aa,1,Growing Base #,"The base is growing.The base is growing, keeping up with the times."
0xb2a44e5e643445a7e105248fb306db29289c87d2,1,Wooonen #,"I am a little pig living by the sea, the name is woonen, I sleep every day in addition to eating, always dreaming, each nft avatar is my dream self, I hope you dream with me!"
0xd031716c1844a4c44e7423e5eff7ca92b0c95372,1,Godly Pepes #,"Half Frogs, Half Gods. Half degenerates, Half misfits. Gods of base & masters of our  universe."
0xfa97094be18130cd651aa9e054b8b7b626434000,1,,
0xa5d7ddcdcc835cc657429773a69b86997bda87ae,1,Monke Special Operations #,Monke Special Operations BASE
0xb97903898cab34268ba6a6e1228946bfe7a8a6e2,1,Dackie #,"The Craziest #NFT community on @BuildOnBase

All of us have the authority to decide who we are going to be..."
0x6ee6e88eb8ae143bb9b4b4b0a2269a080a45ef7e,1,"""Can't Lose My Cool"" - Heno.","â_x0080__x009c_Canâ_x0080__x0099_t Lose My Coolâ_x0080__x009d_ is the latest addition to a cinematic world built through short, narrative pieces by Takoma Park, Maryland rapper Heno as a prologue to his forthcoming, full-length album, Iâ_x0080__x0099_m Tired of Being Hypersurveilled. Using Americaâ_x0080__x0099_s invasive surveillance culture as the bedrock for a deeper, psychological analysis of self and surroundings, Iâ_x0080__x0099_m Tired of Being Hypersurveilled is more than a collection of songs but a highly conceptual, thoughtfully themed critique against the invisible, all-seeing eye surveying todayâ_x0080__x0099_s society and how it continues to support the oppressive systems that disproportionately impacts Black lives.

Through the brief previews provided through teasers like â_x0080__x009c_Canâ_x0080__x0099_t Lose My Cool,â_x0080__x009d_ Heno. continues his slow-burning rollout as he hints towards something major to come.

(Song: SIMMER DOWN by Heno. featuring LatashÃ¡ & J.Robb out now!)"
0x94e23aadba00367dd270d567619d64d178274629,1,Punk Th23 #,"This is a punk th23 , for community holder "
0x787860789b3d4fe81c4bd293fa2baa46f7190ad9,1,,
0x8b559fba48051ca930a646493ca3fcf1c7fe1bf9,1,P3P3 #,P3P3 the Club on Base. Created by ThugManStudio.
0x03a520b32c04bf3beef7beb72e919cf822ed34f1,1,Uniswap - 0.05% - USDbC/WETH - 1725.1<>1809.,"This NFT represents a liquidity position in a Uniswap V3 USDbC-WETH pool. The owner of this NFT can modify or redeem the position.

Pool Address: 0x4c36388be6f416a29c8d8eee81c771ce6be14b18
USDbC Address: 0xd9aaec86b65d86f6a7b5b1b0c42ffa531710b6ca
WETH Address: 0x4200000000000000000000000000000000000006
Fee Tier: 0.05%
Token ID: 3395

â_x009a_ ï¸_x008f_ DISCLAIMER: Due diligence is imperative when assessing this NFT. Make sure token addresses match the expected tokens, as token symbols may be imitated."
0x9859ffab1cfeafa149408aa6b5a9fc7e50054265,1,Based Pixel God #,Based Pixel Gods by WizardX. BPG is a collection of art that exists without purpose. No value is implied. There is no community besides that which you may create yourselves. There is no utility. There is no social media. There is no hype. There is no pump. There is only art.
0x3e73ba2e994d4e8c2a86fc95beaa8171b94c40fc,1,Awesome Base Apes #,2500 Awesome Apes come to Base ecosystem. All Awesome Apes own unique fashion. No random programs or a helper used to create these Apes.